// SF1 Plots Data - Part 2 (continuing from plot 100)
// Area converted from cents to sq ft (1 cent = 435.6 sq ft)

export const sf1Plots2 = [
  // 101. Nirala (Madhavi) - plot 143 - 31.9 cents = 13895.64 sq ft
  { id: 'SF1-143', plotNumber: '143', ownerName: 'Nirala (Madhavi)', mobile: '9342559965', areaSqFt: 13895.64, domainId: 4 },
  
  // 102. Anusha Balaji - plots 145,146 - 44 cents = 19166.4 / 2 = 9583.2 each
  { id: 'SF1-145', plotNumber: '145', ownerName: 'Anusha Balaji', mobile: '9845315231', areaSqFt: 9583.2, domainId: 4 },
  { id: 'SF1-146', plotNumber: '146', ownerName: 'Anusha Balaji', mobile: '9845315231', areaSqFt: 9583.2, domainId: 4 },
  
  // 103. Prasant A. - plot 147 - 22 cents = 9583.2 sq ft
  { id: 'SF1-147', plotNumber: '147', ownerName: 'Prasant A.', mobile: '7907981118', areaSqFt: 9583.2, domainId: 4 },
  
  // 104. Jayanthi - plot 148 - 30 cents = 13068 sq ft
  { id: 'SF1-148', plotNumber: '148', ownerName: 'Jayanthi', mobile: '9886344343', areaSqFt: 13068, domainId: 4 },
  
  // 105. Ratheesh - plot 149 - 22 cents = 9583.2 sq ft
  { id: 'SF1-149', plotNumber: '149', ownerName: 'Ratheesh', mobile: '9886612351', areaSqFt: 9583.2, domainId: 4 },
  
  // 106. Collin Patrick - plot 150 - 22 cents = 9583.2 sq ft
  { id: 'SF1-150', plotNumber: '150', ownerName: 'Collin Patrick', mobile: '7259018099', areaSqFt: 9583.2, domainId: 4 },
  
  // 107. Kunjumon - plot 151 - 22 cents = 9583.2 sq ft
  { id: 'SF1-151', plotNumber: '151', ownerName: 'Kunjumon', mobile: '6382810243', areaSqFt: 9583.2, domainId: 4 },
  
  // 108. Sandeep Chadha - plot 153 - 23 cents = 10018.8 sq ft
  { id: 'SF1-153', plotNumber: '153', ownerName: 'Sandeep Chadha', mobile: '8879661696', areaSqFt: 10018.8, domainId: 4 },
  
  // 109. Satish Kumar - plot 154 - 28.92 cents = 12598.75 sq ft
  { id: 'SF1-154', plotNumber: '154', ownerName: 'Satish Kumar', mobile: '9632711933', areaSqFt: 12598.75, domainId: 4 },
  
  // 110. Unnikrishnan - plot 155 - 23 cents = 10018.8 sq ft
  { id: 'SF1-155', plotNumber: '155', ownerName: 'Unnikrishnan', mobile: '9020078574', areaSqFt: 10018.8, domainId: 4 },
  
  // 111. Srinivasulu Reddy - plot 158 - 60 cents = 26136 sq ft
  { id: 'SF1-158', plotNumber: '158', ownerName: 'Srinivasulu Reddy', mobile: '9886675391', areaSqFt: 26136, domainId: 4 },
  
  // 112. Nandita Panda & Spandan Nanda - plot 161 - 23 cents = 10018.8 sq ft
  { id: 'SF1-161', plotNumber: '161', ownerName: 'Nandita Panda & Spandan Nanda', mobile: '7675914937', areaSqFt: 10018.8, domainId: 4 },
  
  // 113. Sushma Ajay - plots 162,201 - 46 cents = 20037.6 / 2 = 10018.8 each
  { id: 'SF1-162', plotNumber: '162', ownerName: 'Sushma Ajay', mobile: '9986671857', areaSqFt: 10018.8, domainId: 4 },
  { id: 'SF1-201', plotNumber: '201', ownerName: 'Sushma Ajay', mobile: '9986671857', areaSqFt: 10018.8, domainId: 4 },
  
  // 114. Bibash - plot 163 - 23 cents = 10018.8 sq ft
  { id: 'SF1-163', plotNumber: '163', ownerName: 'Bibash', mobile: '9986736887', areaSqFt: 10018.8, domainId: 4 },
  
  // 115. Nazim & Yassar - plot 164 - 40.12 cents = 17476.27 sq ft
  { id: 'SF1-164', plotNumber: '164', ownerName: 'Nazim & Yassar', mobile: '9846960100', areaSqFt: 17476.27, domainId: 4 },
  
  // 116. Aparna Vivek - plot 165 - 27.54 cents = 11995.22 sq ft
  { id: 'SF1-165', plotNumber: '165', ownerName: 'Aparna Vivek', mobile: '9886027334', areaSqFt: 11995.22, domainId: 4 },
  
  // 117. Sumanta Ranjan Das - plot 169 - 23 cents = 10018.8 sq ft
  { id: 'SF1-169', plotNumber: '169', ownerName: 'Sumanta Ranjan Das', mobile: '', areaSqFt: 10018.8, domainId: 4 },
  
  // 118. Gayatri - plot 170 - 28 cents = 12196.8 sq ft
  { id: 'SF1-170', plotNumber: '170', ownerName: 'Gayatri', mobile: '9535775002', areaSqFt: 12196.8, domainId: 4 },
  
  // 119. Toji - plots 182,171 - 53 cents = 23086.8 / 2 = 11543.4 each
  { id: 'SF1-182', plotNumber: '182', ownerName: 'Toji', mobile: '9972372573', areaSqFt: 11543.4, domainId: 4 },
  { id: 'SF1-171', plotNumber: '171', ownerName: 'Toji', mobile: '9972372573', areaSqFt: 11543.4, domainId: 4 },
  
  // 120. Charlesh - plots 179,172,174 - 69 cents = 30056.4 / 3 = 10018.8 each
  { id: 'SF1-179', plotNumber: '179', ownerName: 'Charlesh', mobile: '7760980151', areaSqFt: 10018.8, domainId: 4 },
  { id: 'SF1-172', plotNumber: '172', ownerName: 'Charlesh', mobile: '7760980151', areaSqFt: 10018.8, domainId: 4 },
  { id: 'SF1-174', plotNumber: '174', ownerName: 'Charlesh', mobile: '7760980151', areaSqFt: 10018.8, domainId: 4 },
  
  // 121. Ravi Banka - plot 175 - 23 cents = 10018.8 sq ft
  { id: 'SF1-175', plotNumber: '175', ownerName: 'Ravi Banka', mobile: '9663422887', areaSqFt: 10018.8, domainId: 4 },
  
  // 122. Ramya Srinivas - plot 178 - 23 cents = 10018.8 sq ft
  { id: 'SF1-178', plotNumber: '178', ownerName: 'Ramya Srinivas', mobile: '9845001299', areaSqFt: 10018.8, domainId: 4 },
  
  // 123. Rajani & Biju - plot 177 - 23 cents = 10018.8 sq ft
  { id: 'SF1-177', plotNumber: '177', ownerName: 'Rajani & Biju', mobile: '7339152259', areaSqFt: 10018.8, domainId: 4 },
  
  // 124. Swapnil - plot 185 - 30 cents = 13068 sq ft
  { id: 'SF1-185', plotNumber: '185', ownerName: 'Swapnil', mobile: '8050919365', areaSqFt: 13068, domainId: 4 },
  
  // 125. Biji Bahrain - plot 184 - 25 cents = 10890 sq ft
  { id: 'SF1-184', plotNumber: '184', ownerName: 'Biji Bahrain', mobile: '7334105302', areaSqFt: 10890, domainId: 4 },
  
  // 126. Sangeetha - plot 186 - 27.5 cents = 11979 sq ft
  { id: 'SF1-186', plotNumber: '186', ownerName: 'Sangeetha', mobile: '8105761978', areaSqFt: 11979, domainId: 4 },
  
  // 127. Radhakrishnan - plot 187 - 28.5 cents = 12414.6 sq ft
  { id: 'SF1-187', plotNumber: '187', ownerName: 'Radhakrishnan', mobile: '9886111195', areaSqFt: 12414.6, domainId: 4 },
  
  // 128. Vidhya (Anish) - plot 188 - 28.5 cents = 12414.6 sq ft
  { id: 'SF1-188', plotNumber: '188', ownerName: 'Vidhya (Anish)', mobile: '6238317123', areaSqFt: 12414.6, domainId: 4 },
  
  // 129. Akhil - plots 189,190,191 - 68.87 cents = 29995.57 / 3 = 9998.52 each
  { id: 'SF1-189', plotNumber: '189', ownerName: 'Akhil', mobile: '9886248403', areaSqFt: 9998.52, domainId: 4 },
  { id: 'SF1-190', plotNumber: '190', ownerName: 'Akhil', mobile: '9886248403', areaSqFt: 9998.52, domainId: 4 },
  { id: 'SF1-191', plotNumber: '191', ownerName: 'Akhil', mobile: '9886248403', areaSqFt: 9998.52, domainId: 4 },
  
  // 130. Aakash, Gagan Kumar Sharma - plots 195,196,197 - 23 cents = 10018.8 / 3 = 3339.6 each
  { id: 'SF1-195', plotNumber: '195', ownerName: 'Aakash, Gagan Kumar Sharma', mobile: '8496999000', areaSqFt: 3339.6, domainId: 4 },
  { id: 'SF1-196', plotNumber: '196', ownerName: 'Aakash, Gagan Kumar Sharma', mobile: '8496999000', areaSqFt: 3339.6, domainId: 4 },
  { id: 'SF1-197-A', plotNumber: '197', ownerName: 'Aakash, Gagan Kumar Sharma', mobile: '8496999000', areaSqFt: 3339.6, domainId: 4 },
  
  // 131. Gagan Kumar Sharma - plot 197 - 23 cents = 10018.8 sq ft
  { id: 'SF1-197-G', plotNumber: '197', ownerName: 'Gagan Kumar Sharma', mobile: '9605119864', areaSqFt: 10018.8, domainId: 4 },
  
  // 132. Naomi - plot 202 - 23 cents = 10018.8 sq ft
  { id: 'SF1-202', plotNumber: '202', ownerName: 'Naomi', mobile: '9986201964', areaSqFt: 10018.8, domainId: 4 },
  
  // 133. Naveen - plot 203 - 29.1 cents = 12675.96 sq ft
  { id: 'SF1-203', plotNumber: '203', ownerName: 'Naveen', mobile: '9911654999', areaSqFt: 12675.96, domainId: 4 },
  
  // 134. Deepak Michael - plot 206 - 37.18 cents = 16195.61 sq ft
  { id: 'SF1-206', plotNumber: '206', ownerName: 'Deepak Michael', mobile: '8105409597', areaSqFt: 16195.61, domainId: 4 },
  
  // 135. Kirthana - plot 207 - 33.23 cents = 14474.99 sq ft
  { id: 'SF1-207', plotNumber: '207', ownerName: 'Kirthana', mobile: '9845421987', areaSqFt: 14474.99, domainId: 4 },
  
  // 136. Shashi Kumar - plot 219 - 23 cents = 10018.8 sq ft
  { id: 'SF1-219', plotNumber: '219', ownerName: 'Shashi Kumar', mobile: '9986592272', areaSqFt: 10018.8, domainId: 4 },
  
  // 137. Ganga Raj - plot 217 - 34 cents = 14810.4 sq ft
  { id: 'SF1-217', plotNumber: '217', ownerName: 'Ganga Raj', mobile: '9632219587', areaSqFt: 14810.4, domainId: 4 },
  
  // 138. Hina - plot 220 - 23.16 cents = 10088.5 sq ft
  { id: 'SF1-220', plotNumber: '220', ownerName: 'Hina', mobile: '98207747765', areaSqFt: 10088.5, domainId: 4 },
  
  // 139. Mithun - plot 221 - 23 cents = 10018.8 sq ft
  { id: 'SF1-221', plotNumber: '221', ownerName: 'Mithun', mobile: '9845447248', areaSqFt: 10018.8, domainId: 4 },
  
  // 140. N. Swathi - plot 223 - 23 cents = 10018.8 sq ft
  { id: 'SF1-223', plotNumber: '223', ownerName: 'N. Swathi', mobile: '9791031587', areaSqFt: 10018.8, domainId: 4 },
  
  // 141. Venugopal - plot 224 - 23 cents = 10018.8 sq ft
  { id: 'SF1-224', plotNumber: '224', ownerName: 'Venugopal', mobile: '8547853408', areaSqFt: 10018.8, domainId: 4 },
  
  // 142. Mohit Kumar & Shivangi Mathur - plot 212 - 30.68 cents = 13364.21 sq ft
  { id: 'SF1-212', plotNumber: '212', ownerName: 'Mohit Kumar & Shivangi Mathur', mobile: '9632872655', areaSqFt: 13364.21, domainId: 4 },
  
  // 143. Kaushik & Anshu Reddy - plot 213 - 36.73 cents = 15996.59 sq ft
  { id: 'SF1-213', plotNumber: '213', ownerName: 'Kaushik & Anshu Reddy', mobile: '9740877662', areaSqFt: 15996.59, domainId: 4 },
  
  // 144. Mathangi - plot 214 - 41.82 cents = 18216.79 sq ft
  { id: 'SF1-214', plotNumber: '214', ownerName: 'Mathangi', mobile: '9513339180', areaSqFt: 18216.79, domainId: 4 },
  
  // 145. Praveen Kumar - plots 225,226,227 - 63.83 cents = 27803.75 / 3 = 9267.92 each
  { id: 'SF1-225', plotNumber: '225', ownerName: 'Praveen Kumar', mobile: '9020770111', areaSqFt: 9267.92, domainId: 4 },
  { id: 'SF1-226', plotNumber: '226', ownerName: 'Praveen Kumar', mobile: '9020770111', areaSqFt: 9267.92, domainId: 4 },
  { id: 'SF1-227', plotNumber: '227', ownerName: 'Praveen Kumar', mobile: '9020770111', areaSqFt: 9267.92, domainId: 4 },
  
  // 146. Jamshid - plots A Frame,192,193,194,228 - 120.53 cents = 52486.87 / 5 = 10497.37 each
  { id: 'SF1-AFRAME', plotNumber: 'A Frame', ownerName: 'Jamshid', mobile: '66506967229', areaSqFt: 10497.37, domainId: 4 },
  { id: 'SF1-192', plotNumber: '192', ownerName: 'Jamshid', mobile: '66506967229', areaSqFt: 10497.37, domainId: 4 },
  { id: 'SF1-193', plotNumber: '193', ownerName: 'Jamshid', mobile: '66506967229', areaSqFt: 10497.37, domainId: 4 },
  { id: 'SF1-194', plotNumber: '194', ownerName: 'Jamshid', mobile: '66506967229', areaSqFt: 10497.37, domainId: 4 },
  { id: 'SF1-228-J', plotNumber: '228', ownerName: 'Jamshid', mobile: '66506967229', areaSqFt: 10497.37, domainId: 4 },
  
  // 147. Saurabh Grover - plot 180 - 23 cents = 10018.8 sq ft
  { id: 'SF1-180', plotNumber: '180', ownerName: 'Saurabh Grover', mobile: '7506077248', areaSqFt: 10018.8, domainId: 4 },
  
  // 148. Juhi - plot 230 - 23 cents = 10018.8 sq ft
  { id: 'SF1-230', plotNumber: '230', ownerName: 'Juhi', mobile: '9844658041', areaSqFt: 10018.8, domainId: 4 },
  
  // 149. Rupali - plot 229 - no area
  { id: 'SF1-229', plotNumber: '229', ownerName: 'Rupali', mobile: '', areaSqFt: 0, domainId: 4 },
  
  // 150. Kailash Joshi - plot 209 - 23 cents = 10018.8 sq ft
  { id: 'SF1-209', plotNumber: '209', ownerName: 'Kailash Joshi', mobile: '9900506191', areaSqFt: 10018.8, domainId: 4 },
  
  // 151. Manish Gupta - plots 199,200 - 46 cents = 20037.6 / 2 = 10018.8 each
  { id: 'SF1-199', plotNumber: '199', ownerName: 'Manish Gupta', mobile: '9845911211', areaSqFt: 10018.8, domainId: 4 },
  { id: 'SF1-200', plotNumber: '200', ownerName: 'Manish Gupta', mobile: '9845911211', areaSqFt: 10018.8, domainId: 4 },
  
  // 152. Namit Sood - plot 208 - 24.11 cents = 10502.32 sq ft
  { id: 'SF1-208', plotNumber: '208', ownerName: 'Namit Sood', mobile: '9811880343', areaSqFt: 10502.32, domainId: 4 },
  
  // 153. Rahul & Priyanka Tripathi - plot 235 - 46 cents = 20037.6 sq ft
  { id: 'SF1-235', plotNumber: '235', ownerName: 'Rahul & Priyanka Tripathi', mobile: '9880911000, 8971791791', areaSqFt: 20037.6, domainId: 4 },
  
  // 154. Kumarasamy - plot 231 - 29.42 cents = 12813.35 sq ft
  { id: 'SF1-231', plotNumber: '231', ownerName: 'Kumarasamy', mobile: '6383379993', areaSqFt: 12813.35, domainId: 4 },
  
  // 155. Gopala Krishnan - plot 232 - 29.32 cents = 12769.79 sq ft
  { id: 'SF1-232', plotNumber: '232', ownerName: 'Gopala Krishnan', mobile: '9962592202', areaSqFt: 12769.79, domainId: 4 },
  
  // 156. Vishnu - plot 233 - 23 cents = 10018.8 sq ft
  { id: 'SF1-233', plotNumber: '233', ownerName: 'Vishnu', mobile: '8144390624', areaSqFt: 10018.8, domainId: 4 },
  
  // 157. Sasikala - plot 233/Part - 23 cents = 10018.8 sq ft
  { id: 'SF1-233-P', plotNumber: '233/Part', ownerName: 'Sasikala', mobile: '9900075581 (Saiju Nair)', areaSqFt: 10018.8, domainId: 4 },
  
  // 158. Donald - plot 234 - 87.68 cents = 38189.81 sq ft
  { id: 'SF1-234', plotNumber: '234', ownerName: 'Donald', mobile: '9845179219', areaSqFt: 38189.81, domainId: 4 },
  
  // 159. Dinesh - plot 216 - 30 cents = 13068 sq ft
  { id: 'SF1-216', plotNumber: '216', ownerName: 'Dinesh', mobile: '9886038355', areaSqFt: 13068, domainId: 4 },
  
  // 160. Sarita Devi - plot 217 - 50 cents = 21780 sq ft (note: 217 also owned by Ganga Raj)
  { id: 'SF1-217-S', plotNumber: '217', ownerName: 'Sarita Devi', mobile: '9986426938', areaSqFt: 21780, domainId: 4 },
  
  // 161. Severena - plot 250 - 50 cents = 21780 sq ft
  { id: 'SF1-250', plotNumber: '250', ownerName: 'Severena', mobile: '9845287908', areaSqFt: 21780, domainId: 4 },
  
  // 162. Saurabh - plot 251 - 37 cents = 16117.2 sq ft
  { id: 'SF1-251', plotNumber: '251', ownerName: 'Saurabh', mobile: '', areaSqFt: 16117.2, domainId: 4 },
  
  // 163. Saurabh Malhotra & Poonam Taneja - plot 198 - 33.2 cents = 14461.92 sq ft
  { id: 'SF1-198', plotNumber: '198', ownerName: 'Saurabh Malhotra & Poonam Taneja', mobile: '8860280228', areaSqFt: 14461.92, domainId: 4 },
  
  // 164. Ranjeeth Thyagarajan & Veena.V - plots 239,240 - 46 cents = 20037.6 / 2 = 10018.8 each
  { id: 'SF1-239', plotNumber: '239', ownerName: 'Ranjeeth Thyagarajan & Veena.V', mobile: '9845597312', areaSqFt: 10018.8, domainId: 4 },
  { id: 'SF1-240', plotNumber: '240', ownerName: 'Ranjeeth Thyagarajan & Veena.V', mobile: '9845597312', areaSqFt: 10018.8, domainId: 4 },
  
  // 165. Dilu Sadasivan - plot 249 - 29.5 cents = 12850.2 sq ft
  { id: 'SF1-249', plotNumber: '249', ownerName: 'Dilu Sadasivan', mobile: '9986019545', areaSqFt: 12850.2, domainId: 4 },
  
  // 166. Shihab - plots 242,243,244,245,246 (excluding 000s) - 207 cents = 90169.2 / 5 = 18033.84 each
  { id: 'SF1-242', plotNumber: '242', ownerName: 'Shihab', mobile: '7411170252', areaSqFt: 18033.84, domainId: 4 },
  { id: 'SF1-243', plotNumber: '243', ownerName: 'Shihab', mobile: '7411170252', areaSqFt: 18033.84, domainId: 4 },
  { id: 'SF1-244', plotNumber: '244', ownerName: 'Shihab', mobile: '7411170252', areaSqFt: 18033.84, domainId: 4 },
  { id: 'SF1-245', plotNumber: '245', ownerName: 'Shihab', mobile: '7411170252', areaSqFt: 18033.84, domainId: 4 },
  { id: 'SF1-246', plotNumber: '246', ownerName: 'Shihab', mobile: '7411170252', areaSqFt: 18033.84, domainId: 4 },
  
  // 167. Soorej & Anju - plot 241 - 23 cents = 10018.8 sq ft
  { id: 'SF1-241', plotNumber: '241', ownerName: 'Soorej & Anju', mobile: '9880570552', areaSqFt: 10018.8, domainId: 4 },
  
  // 168. Jatinder - plot 237 - 27 cents = 11761.2 sq ft
  { id: 'SF1-237', plotNumber: '237', ownerName: 'Jatinder', mobile: '9310026719', areaSqFt: 11761.2, domainId: 4 },
  
  // 169. Vishal - plot 236 - 28.5 cents = 12414.6 sq ft
  { id: 'SF1-236', plotNumber: '236', ownerName: 'Vishal', mobile: '9566660941', areaSqFt: 12414.6, domainId: 4 },
  
  // 170. Rishi - plot 238 - 23 cents = 10018.8 sq ft
  { id: 'SF1-238', plotNumber: '238', ownerName: 'Rishi', mobile: '9243189834', areaSqFt: 10018.8, domainId: 4 },
  
  // 171. Varghese Thomas - plot 252 - 24.5 cents = 10672.2 sq ft
  { id: 'SF1-252', plotNumber: '252', ownerName: 'Varghese Thomas', mobile: '9886074863', areaSqFt: 10672.2, domainId: 4 },
  
  // 172. Sujatha Raman - plot 253 - 26 cents = 11325.6 sq ft - registered 13.05.2024
  { id: 'SF1-253', plotNumber: '253', ownerName: 'Sujatha Raman', mobile: '9480975108', areaSqFt: 11325.6, registrationDate: '2024-05-13', domainId: 4 },
  
  // 173. Mohammed Goulrez - plot 254 - 23 cents = 10018.8 sq ft - registered 21.06.2024
  { id: 'SF1-254', plotNumber: '254', ownerName: 'Mohammed Goulrez', mobile: '9770966866', areaSqFt: 10018.8, registrationDate: '2024-06-21', domainId: 4 },
  
  // 174. Karthik Kumar - plot 255 - 28.7 cents = 12501.72 sq ft - registered 18.05.2024
  { id: 'SF1-255', plotNumber: '255', ownerName: 'Karthik Kumar', mobile: '9884341742', areaSqFt: 12501.72, registrationDate: '2024-05-18', domainId: 4 },
  
  // 175. Ashish Bhanot, Divvyansh Bhanot - plot 256 - 23 cents = 10018.8 sq ft
  { id: 'SF1-256', plotNumber: '256', ownerName: 'Ashish Bhanot, Divvyansh Bhanot', mobile: '7338458668, 9846071028, 8296431417', areaSqFt: 10018.8, domainId: 4 },
  
  // 176. Manohar - plot 257 - 23 cents = 10018.8 sq ft
  { id: 'SF1-257', plotNumber: '257', ownerName: 'Manohar', mobile: '9945876497', areaSqFt: 10018.8, domainId: 4 },
  
  // 177. Hamsa - plot 258 - 23 cents = 10018.8 sq ft
  { id: 'SF1-258', plotNumber: '258', ownerName: 'Hamsa', mobile: '8762173058', areaSqFt: 10018.8, domainId: 4 },
  
  // 178. Vidya - plot 259 - 25.25 cents = 10998.9 sq ft - registered 23.07.2025
  { id: 'SF1-259', plotNumber: '259', ownerName: 'Vidya', mobile: '8971888757', areaSqFt: 10998.9, registrationDate: '2025-07-23', domainId: 4 },
  
  // 179. Shivakumar & Priyadharshini - plot 260 - 29 cents = 12632.4 sq ft
  { id: 'SF1-260', plotNumber: '260', ownerName: 'Shivakumar & Priyadharshini', mobile: '9900477177', areaSqFt: 12632.4, domainId: 4 },
  
  // 180. Vivek Anand Singh & Ketki Singh - plot 261 - 41.5 cents = 18077.4 sq ft
  { id: 'SF1-261', plotNumber: '261', ownerName: 'Vivek Anand Singh & Ketki Singh', mobile: '9108483100', areaSqFt: 18077.4, domainId: 4 },
  
  // 181. Sanjeev Kunal & Aparajita Pathak - plot 262 - 41.5 cents = 18077.4 sq ft
  { id: 'SF1-262', plotNumber: '262', ownerName: 'Sanjeev Kunal & Aparajita Pathak', mobile: '9007534780', areaSqFt: 18077.4, domainId: 4 },
  
  // 182. Unknown - plots 263,277 - 57.46 cents = 25028.38 / 2 = 12514.19 each
  { id: 'SF1-263', plotNumber: '263', ownerName: 'Unknown', mobile: '9619369126', areaSqFt: 12514.19, domainId: 4 },
  { id: 'SF1-277', plotNumber: '277', ownerName: 'Unknown', mobile: '9619369126', areaSqFt: 12514.19, domainId: 4 },
  
  // 183. Kishore & Lakshmi - plot 157 - 30 cents = 13068 sq ft
  { id: 'SF1-157', plotNumber: '157', ownerName: 'Kishore & Lakshmi', mobile: '9886262243', areaSqFt: 13068, domainId: 4 },
  
  // 184. Kandasamy Kumarasamy & Meenu Shankari Seilvaraju - plot 264 - 23.48 cents = 10227.89 sq ft - registered 22.03.2025
  { id: 'SF1-264', plotNumber: '264', ownerName: 'Kandasamy Kumarasamy & Meenu Shankari Seilvaraju', mobile: '9944503678', areaSqFt: 10227.89, registrationDate: '2025-03-22', domainId: 4 },
  
  // 185. Sushovan Nandan - plot 219 - 24 cents = 10454.4 sq ft - registered 05.02.2025
  { id: 'SF1-219-S', plotNumber: '219', ownerName: 'Sushovan Nandan', mobile: '8013040556', areaSqFt: 10454.4, registrationDate: '2025-02-05', domainId: 4 },
  
  // 186. Chandan H.N & Shruthi B.N - plot 265 - 23 cents = 10018.8 sq ft - registered 05.04.2025
  { id: 'SF1-265', plotNumber: '265', ownerName: 'Chandan H.N & Shruthi B.N', mobile: '9738515738', areaSqFt: 10018.8, registrationDate: '2025-04-05', domainId: 4 },
  
  // 187. Reuben Singh & Supriya Sharma - plots 266,267 - 50 cents = 21780 / 2 = 10890 each - registered 05.04.2025
  { id: 'SF1-266', plotNumber: '266', ownerName: 'Reuben Singh & Supriya Sharma', mobile: '9873190309', areaSqFt: 10890, registrationDate: '2025-04-05', domainId: 4 },
  { id: 'SF1-267', plotNumber: '267', ownerName: 'Reuben Singh & Supriya Sharma', mobile: '9873190309', areaSqFt: 10890, registrationDate: '2025-04-05', domainId: 4 },
  
  // 188. Divya Pandey - plot 268 - 50 cents = 21780 sq ft - registered 08.03.2025
  { id: 'SF1-268', plotNumber: '268', ownerName: 'Divya Pandey', mobile: '8585961973', areaSqFt: 21780, registrationDate: '2025-03-08', domainId: 4 },
  
  // 189. Geetika (Sandeep) - plot 270 - 23.15 cents = 10084.14 sq ft - registered 07.08.2025
  { id: 'SF1-270', plotNumber: '270', ownerName: 'Geetika (Sandeep)', mobile: '8860821231', areaSqFt: 10084.14, registrationDate: '2025-08-07', domainId: 4 },
  
  // 190. Chandha Sai Kiran & Sri Laxmi - plot 271 - 23 cents = 10018.8 sq ft - registered 17.05.2025
  { id: 'SF1-271', plotNumber: '271', ownerName: 'Chandha Sai Kiran & Sri Laxmi', mobile: '7795734733', areaSqFt: 10018.8, registrationDate: '2025-05-17', domainId: 4 },
  
  // 191. Buchi Rama Naga Siva Srikanth Talisetty - plot 272 - 23 cents = 10018.8 sq ft - registered 31.05.2025
  { id: 'SF1-272', plotNumber: '272', ownerName: 'Buchi Rama Naga Siva Srikanth Talisetty', mobile: '9886811191', areaSqFt: 10018.8, registrationDate: '2025-05-31', domainId: 4 },
  
  // 192. Muthuswamy Anand & Deeptha Gopal - plots 273,274 - 46 cents = 20037.6 / 2 = 10018.8 each - registered 27.06.2025
  { id: 'SF1-273', plotNumber: '273', ownerName: 'Muthuswamy Anand & Deeptha Gopal', mobile: '9880630033', areaSqFt: 10018.8, registrationDate: '2025-06-27', domainId: 4 },
  { id: 'SF1-274', plotNumber: '274', ownerName: 'Muthuswamy Anand & Deeptha Gopal', mobile: '9880630033', areaSqFt: 10018.8, registrationDate: '2025-06-27', domainId: 4 },
  
  // 193. Roopal (Nimit) - plot 279 - 23 cents = 10018.8 sq ft - registered 04.08.2025
  { id: 'SF1-279', plotNumber: '279', ownerName: 'Roopal (Nimit)', mobile: '9008744415', areaSqFt: 10018.8, registrationDate: '2025-08-04', domainId: 4 },
  
  // 194. Shikha Dixit (Arun) - plot 69 - 25.06 cents = 10916.14 sq ft - registered 11.04.2025
  { id: 'SF1-69', plotNumber: '69', ownerName: 'Shikha Dixit (Arun)', mobile: '9916641673', areaSqFt: 10916.14, registrationDate: '2025-04-11', domainId: 4 },
  
  // 195. Krishnaji Rao & Sujatha - plot 286 - 34.32 cents = 14949.79 sq ft - registered 20.08.2052 (typo in original)
  { id: 'SF1-286', plotNumber: '286', ownerName: 'Krishnaji Rao & Sujatha', mobile: '9739810229', areaSqFt: 14949.79, registrationDate: '2025-08-20', domainId: 4 },
  
  // 196. Sushma Ajay Jain - plot 228 - 47.14 cents = 20530.58 sq ft - registered 22.05.2025
  { id: 'SF1-228', plotNumber: '228', ownerName: 'Sushma Ajay Jain', mobile: '9986671857', areaSqFt: 20530.58, registrationDate: '2025-05-22', domainId: 4 },
  
  // 197. Usha - plot 275 - 23 cents = 10018.8 sq ft - registered 11.09.2025
  { id: 'SF1-275', plotNumber: '275', ownerName: 'Usha', mobile: '9986511537', areaSqFt: 10018.8, registrationDate: '2025-09-11', domainId: 4 },
  
  // 198. Sachin Kakkar & Nidhi Jain - plots 282,283 - 46 cents = 20037.6 / 2 = 10018.8 each - registered 11.10.2025
  { id: 'SF1-282', plotNumber: '282', ownerName: 'Sachin Kakkar & Nidhi Jain', mobile: '9632642500', areaSqFt: 10018.8, registrationDate: '2025-10-11', domainId: 4 },
  { id: 'SF1-283', plotNumber: '283', ownerName: 'Sachin Kakkar & Nidhi Jain', mobile: '9632642500', areaSqFt: 10018.8, registrationDate: '2025-10-11', domainId: 4 },
  
  // 199. Thirumalai Sridhar - plot 284 - 23 cents = 10018.8 sq ft - registered 27.10.2025
  { id: 'SF1-284', plotNumber: '284', ownerName: 'Thirumalai Sridhar', mobile: '9952025467', areaSqFt: 10018.8, registrationDate: '2025-10-27', domainId: 4 },
  
  // 200. Juhi Agrawal (Sangam) - plot 288 - 23 cents = 10018.8 sq ft - registered 24.10.2025
  { id: 'SF1-288', plotNumber: '288', ownerName: 'Juhi Agrawal (Sangam)', mobile: '8147516182', areaSqFt: 10018.8, registrationDate: '2025-10-24', domainId: 4 },
  
  // 201. Preetham Poovani - plot 289 - 23 cents = 10018.8 sq ft - registered 11.10.2025
  { id: 'SF1-289', plotNumber: '289', ownerName: 'Preetham Poovani', mobile: '9731274747', areaSqFt: 10018.8, registrationDate: '2025-10-11', domainId: 4 },
  
  // 202. Yashodhara & Abhishek - plot 291 - 23 cents = 10018.8 sq ft - registered 01.11.2025
  { id: 'SF1-291', plotNumber: '291', ownerName: 'Yashodhara & Abhishek', mobile: '9448363577', areaSqFt: 10018.8, registrationDate: '2025-11-01', domainId: 4 },
  
  // 203. Shubham & Diksha - plot 280 - 23 cents = 10018.8 sq ft - registered 08.11.2025
  { id: 'SF1-280', plotNumber: '280', ownerName: 'Shubham & Diksha', mobile: '8051681005', areaSqFt: 10018.8, registrationDate: '2025-11-08', domainId: 4 },
  
  // 204. Shashank - plot 269 - 23 cents = 10018.8 sq ft - registered 10.12.2025
  { id: 'SF1-269', plotNumber: '269', ownerName: 'Shashank', mobile: '9731866881', areaSqFt: 10018.8, registrationDate: '2025-12-10', domainId: 4 },
  
  // 205. Deepak & Maliha - plot 276 - 23 cents = 10018.8 sq ft - registered 08.12.2025
  { id: 'SF1-276', plotNumber: '276', ownerName: 'Deepak & Maliha', mobile: '9538093640', areaSqFt: 10018.8, registrationDate: '2025-12-08', domainId: 4 },
  
  // 206. Karthika & Preetha - plot 281 - 23 cents = 10018.8 sq ft - registered 10.11.2025
  { id: 'SF1-281', plotNumber: '281', ownerName: 'Karthika & Preetha', mobile: '9632248248', areaSqFt: 10018.8, registrationDate: '2025-11-10', domainId: 4 },
  
  // 207. Geetha - plot 287 - 23 cents = 10018.8 sq ft - registered 15.11.2025
  { id: 'SF1-287', plotNumber: '287', ownerName: 'Geetha', mobile: '9980921380', areaSqFt: 10018.8, registrationDate: '2025-11-15', domainId: 4 },
  
  // 208. Abhishek & Yashodhara - plot 291 - 23 cents = 10018.8 sq ft - registered 01.11.2025 (duplicate of 202)
  // Skipping as duplicate
  
  // 209. Narasimha & Saroja - plot 301 - 23.22 cents = 10114.63 sq ft - registered 01.12.2025
  { id: 'SF1-301', plotNumber: '301', ownerName: 'Narasimha & Saroja', mobile: '9448532657', areaSqFt: 10114.63, registrationDate: '2025-12-01', domainId: 4 },
  
  // 210. Vidya - plot 259 - 25.75 cents = 11216.7 sq ft - registered 23.07.2025 (duplicate/update of 178)
  // Already covered in entry 178
];

